{
  "format_version": 2,
  "plan_id": "2001",
  "target": {
    "target_id": "poseidon-ckks-cpu",
    "capability_version": 1,
    "operator_spec": {
      "id": "poseidon-ckks-cpu-v1",
      "version": 1,
      "source_sha256": "sha256:895301761eb595b6eaa4acca85cadb7aad869639fabdd2b9789518c3b85ae1a1"
    },
    "world_size": 1,
    "device_counts": [
      1
    ]
  },
  "values": [
    {
      "id": "1",
      "kind": "ciphertext",
      "place": {
        "kind": "host",
        "rank": 0
      },
      "context": "ctx-main",
      "level": 5,
      "scale_log2": 40,
      "ntt": true,
      "components": 2
    },
    {
      "id": "2",
      "kind": "plaintext",
      "place": {
        "kind": "host",
        "rank": 0
      },
      "context": "ctx-main",
      "level": 5,
      "scale_log2": 40,
      "ntt": true,
      "components": 1
    },
    {
      "id": "3",
      "kind": "ciphertext",
      "place": {
        "kind": "host",
        "rank": 0
      },
      "context": "ctx-main",
      "level": 5,
      "scale_log2": 40,
      "ntt": true,
      "components": 2
    },
    {
      "id": "4",
      "kind": "ciphertext",
      "place": {
        "kind": "host",
        "rank": 0
      },
      "context": "ctx-main",
      "level": 5,
      "scale_log2": 40,
      "ntt": true,
      "components": 2
    },
    {
      "id": "5",
      "kind": "ciphertext",
      "place": {
        "kind": "host",
        "rank": 0
      },
      "context": "ctx-main",
      "level": 5,
      "scale_log2": 40,
      "ntt": true,
      "components": 2
    },
    {
      "id": "6",
      "kind": "ciphertext",
      "place": {
        "kind": "host",
        "rank": 0
      },
      "context": "ctx-main",
      "level": 5,
      "scale_log2": 40,
      "ntt": true,
      "components": 2
    }
  ],
  "external_inputs": [
    "1"
  ],
  "initialization": [
    {
      "ordinal": 0,
      "kind": "encode",
      "payload": {
        "kind": "inline",
        "values": [
          1,
          -0.0,
          3.5,
          -2
        ]
      },
      "output": "2"
    },
    {
      "ordinal": 1,
      "kind": "compute",
      "op": "add_cp",
      "place": {
        "kind": "host",
        "rank": 0
      },
      "inputs": [
        "1",
        "2"
      ],
      "output": "3"
    },
    {
      "ordinal": 2,
      "kind": "release",
      "value": "1"
    },
    {
      "ordinal": 3,
      "kind": "release",
      "value": "2"
    }
  ],
  "execution": [
    {
      "ordinal": 4,
      "kind": "compute",
      "op": "negate",
      "place": {
        "kind": "host",
        "rank": 0
      },
      "inputs": [
        "3"
      ],
      "output": "4",
      "reuse_input": 0
    },
    {
      "ordinal": 5,
      "kind": "compute",
      "op": "rotate",
      "place": {
        "kind": "host",
        "rank": 0
      },
      "inputs": [
        "4"
      ],
      "output": "5",
      "reuse_input": 0,
      "attrs": {
        "steps": -1
      }
    }
  ],
  "finalization": [
    {
      "ordinal": 6,
      "kind": "compute",
      "op": "negate",
      "place": {
        "kind": "host",
        "rank": 0
      },
      "inputs": [
        "5"
      ],
      "output": "6",
      "reuse_input": 0
    }
  ],
  "final_outputs": [
    "6"
  ]
}
