{
  "format_version": 2,
  "plan_id": "2002",
  "target": {
    "target_id": "poseidon-ckks-gpu",
    "capability_version": 1,
    "operator_spec": {
      "id": "poseidon-ckks-gpu-v1",
      "version": 1,
      "source_sha256": "sha256:9b578bcac67c9ee2cace717ad9a6733053e46dbf574f195329ef1d255c9663eb"
    },
    "world_size": 1,
    "device_counts": [
      1
    ]
  },
  "values": [
    {
      "id": "1",
      "kind": "ciphertext",
      "place": {
        "kind": "host",
        "rank": 0
      },
      "context": "ctx-main",
      "level": 5,
      "scale_log2": 40,
      "ntt": true,
      "components": 2
    },
    {
      "id": "2",
      "kind": "plaintext",
      "place": {
        "kind": "host",
        "rank": 0
      },
      "context": "ctx-main",
      "level": 5,
      "scale_log2": 40,
      "ntt": true,
      "components": 1
    },
    {
      "id": "3",
      "kind": "ciphertext",
      "place": {
        "kind": "device",
        "rank": 0,
        "index": 0
      },
      "context": "ctx-main",
      "level": 5,
      "scale_log2": 40,
      "ntt": true,
      "components": 2
    },
    {
      "id": "4",
      "kind": "ciphertext",
      "place": {
        "kind": "device",
        "rank": 0,
        "index": 0
      },
      "context": "ctx-main",
      "level": 5,
      "scale_log2": 40,
      "ntt": true,
      "components": 2
    },
    {
      "id": "5",
      "kind": "ciphertext",
      "place": {
        "kind": "device",
        "rank": 0,
        "index": 0
      },
      "context": "ctx-main",
      "level": 5,
      "scale_log2": 40,
      "ntt": true,
      "components": 2
    },
    {
      "id": "6",
      "kind": "ciphertext",
      "place": {
        "kind": "device",
        "rank": 0,
        "index": 0
      },
      "context": "ctx-main",
      "level": 5,
      "scale_log2": 40,
      "ntt": true,
      "components": 2
    },
    {
      "id": "7",
      "kind": "ciphertext",
      "place": {
        "kind": "device",
        "rank": 0,
        "index": 0
      },
      "context": "ctx-main",
      "level": 5,
      "scale_log2": 40,
      "ntt": true,
      "components": 2
    },
    {
      "id": "8",
      "kind": "plaintext",
      "place": {
        "kind": "device",
        "rank": 0,
        "index": 0
      },
      "context": "ctx-main",
      "level": 5,
      "scale_log2": 40,
      "ntt": true,
      "components": 1
    }
  ],
  "external_inputs": [
    "1"
  ],
  "initialization": [
    {
      "ordinal": 0,
      "kind": "encode",
      "payload": {
        "kind": "inline",
        "values": [
          1,
          -0.0,
          3.5,
          -2
        ]
      },
      "output": "2"
    },
    {
      "ordinal": 1,
      "kind": "transfer",
      "transfer_id": "1",
      "hint": "point_to_point",
      "inputs": [
        "1"
      ],
      "outputs": [
        "7"
      ],
      "sources": [
        {
          "kind": "host",
          "rank": 0
        }
      ],
      "destinations": [
        {
          "kind": "device",
          "rank": 0,
          "index": 0
        }
      ],
      "output_kinds": [
        "ciphertext"
      ]
    },
    {
      "ordinal": 2,
      "kind": "transfer",
      "transfer_id": "2",
      "hint": "point_to_point",
      "inputs": [
        "2"
      ],
      "outputs": [
        "8"
      ],
      "sources": [
        {
          "kind": "host",
          "rank": 0
        }
      ],
      "destinations": [
        {
          "kind": "device",
          "rank": 0,
          "index": 0
        }
      ],
      "output_kinds": [
        "plaintext"
      ]
    },
    {
      "ordinal": 3,
      "kind": "compute",
      "op": "negate",
      "place": {
        "kind": "device",
        "rank": 0,
        "index": 0
      },
      "inputs": [
        "7"
      ],
      "output": "3"
    },
    {
      "ordinal": 4,
      "kind": "release",
      "value": "7"
    },
    {
      "ordinal": 5,
      "kind": "release",
      "value": "1"
    },
    {
      "ordinal": 6,
      "kind": "release",
      "value": "2"
    }
  ],
  "execution": [
    {
      "ordinal": 7,
      "kind": "compute",
      "op": "add_cp",
      "place": {
        "kind": "device",
        "rank": 0,
        "index": 0
      },
      "inputs": [
        "3",
        "8"
      ],
      "output": "4",
      "reuse_input": 0
    },
    {
      "ordinal": 8,
      "kind": "compute",
      "op": "sub_cp",
      "place": {
        "kind": "device",
        "rank": 0,
        "index": 0
      },
      "inputs": [
        "4",
        "8"
      ],
      "output": "5",
      "reuse_input": 0
    },
    {
      "ordinal": 9,
      "kind": "compute",
      "op": "rotate",
      "place": {
        "kind": "device",
        "rank": 0,
        "index": 0
      },
      "inputs": [
        "5"
      ],
      "output": "6",
      "reuse_input": 0,
      "attrs": {
        "steps": 1
      }
    }
  ],
  "finalization": [
    {
      "ordinal": 10,
      "kind": "release",
      "value": "8"
    }
  ],
  "final_outputs": [
    "6"
  ]
}
